{
  "schemaVersion": "1.0.0",
  "bundleId": "bundle_express_50_path_to_regexp_001",
  "status": "VERIFIED",
  "description": "Express 5.0 updates path-to-regexp from v0.1 to v8.0, requiring wildcard routes to use named parameter syntax (/{*splat}) instead of raw asterisks (*).",
  "tags": ["express", "nodejs", "routing", "v50"],
  "scope": {
    "package": "express",
    "fromVersion": "4.19.2",
    "toVersion": "5.0.0",
    "runtime": "nodejs",
    "runtimeVersion": "22.0.0",
    "platform": "all"
  },
  "fingerprint": {
    "errorSignature": "TypeError: Missing parameter name at 1: /*",
    "regex": "TypeError: Missing parameter name at 1",
    "matchStream": "stderr"
  },
  "patch": {
    "targetFile": "router.js",
    "unifiedDiff": "--- a/router.js\n+++ b/router.js\n@@ -1,3 +1,3 @@\n function registerWildcard(app) {\n-    return app.get('/*', (req, res) => res.send('catchall'));\n+    return app.get('/{*splat}', (req, res) => res.send('catchall'));\n }\n",
    "pinnedDependencies": {
      "express": "5.0.0"
    },
    "doNot": [
      "Do not use bare asterisks in Express 5 routes",
      "Do not pin express<5.0.0 to avoid route syntax upgrades"
    ]
  },
  "verification": {
    "scriptLanguage": "javascript",
    "workspaceFiles": {
      "router.js": "function registerWildcard(app) {\n    return app.get('/*', (req, res) => res.send('catchall'));\n}\nmodule.exports = { registerWildcard };\n"
    },
    "reproductionScript": "const { registerWildcard } = require('./router.js');\nconst mockApp = {\n    get: (route, handler) => {\n        if (route === '/*') {\n            const err = new TypeError('TypeError: Missing parameter name at 1: /*');\n            console.error(err.message);\n            process.exit(1);\n        }\n        return 'OK';\n    }\n};\ntry {\n    registerWildcard(mockApp);\n    process.exit(0);\n} catch (e) {\n    process.exit(1);\n}\n",
    "testSuite": "const { registerWildcard } = require('./router.js');\nconst mockApp = {\n    get: (route, handler) => {\n        if (route === '/*') {\n            throw new TypeError('TypeError: Missing parameter name at 1: /*');\n        }\n        if (route === '/{*splat}') {\n            return 'OK';\n        }\n        throw new Error('Unexpected route: ' + route);\n    }\n};\nconst res = registerWildcard(mockApp);\nif (res !== 'OK') process.exit(1);\nconsole.log('VERIFICATION_SUCCESS_STAGE_3');\nprocess.exit(0);\n",
    "mutations": [
      {
        "id": "mutant_empty_catchall",
        "description": "Replaces wildcard with empty string which misses nested routes",
        "unifiedDiff": "--- a/router.js\n+++ b/router.js\n@@ -1,3 +1,3 @@\n function registerWildcard(app) {\n-    return app.get('/*', (req, res) => res.send('catchall'));\n+    return app.get('', (req, res) => res.send('catchall'));\n }\n"
      },
      {
        "id": "mutant_double_star",
        "description": "Uses globstar ** which is also invalid in path-to-regexp v8",
        "unifiedDiff": "--- a/router.js\n+++ b/router.js\n@@ -1,3 +1,3 @@\n function registerWildcard(app) {\n-    return app.get('/*', (req, res) => res.send('catchall'));\n+    return app.get('/**', (req, res) => res.send('catchall'));\n }\n"
      }
    ],
    "expectedPreExit": 1,
    "expectedPostExit": 0,
    "timeoutMs": 15000
  },
  "provenance": {
    "spdxLicense": "MIT",
    "primarySources": [
      "https://expressjs.com/en/guide/migrating-5.html#routing"
    ],
    "verifiedAt": "2026-08-25T11:42:00Z"
  }
}
