{
  "schemaVersion": "1.0.0",
  "bundleId": "bundle_nextjs_15_async_params_001",
  "status": "VERIFIED",
  "description": "Next.js 15 dynamic App Router parameters are promises and must be typed and consumed asynchronously.",
  "tags": [
    "nextjs",
    "typescript",
    "app-router",
    "async-request-apis"
  ],
  "scope": {
    "package": "next",
    "fromVersion": "14.2.0",
    "toVersion": "15.5.9",
    "runtime": "nodejs",
    "runtimeVersion": "22.23.2",
    "platform": "all"
  },
  "fingerprint": {
    "errorSignature": "Type '{ params: { slug: string; }; }' does not satisfy the constraint 'PageProps'.",
    "regex": "Type error:[\\s\\S]*params[\\s\\S]*(?:does not satisfy the constraint ['\"]PageProps['\"]|missing the following properties from type ['\"]Promise)",
    "regexFlags": "i",
    "matchStream": "combined"
  },
  "patch": {
    "targetFile": "app/blog/[slug]/page.tsx",
    "unifiedDiff": "--- a/app/blog/[slug]/page.tsx\n+++ b/app/blog/[slug]/page.tsx\n@@ -1,7 +1,8 @@\n-export default function Page({\n+export default async function Page({\n   params,\n }: {\n-  params: { slug: string };\n+  params: Promise<{ slug: string }>;\n }) {\n-  return <h1>{params.slug}</h1>;\n+  const { slug } = await params;\n+  return <h1>{slug}</h1>;\n }\n",
    "pinnedDependencies": {
      "next": "15.5.9",
      "react": "19.1.1",
      "react-dom": "19.1.1",
      "typescript": "5.8.3",
      "@types/node": "22.15.3",
      "@types/react": "19.1.10",
      "@types/react-dom": "19.1.7"
    },
    "doNot": [
      "Do not keep params typed as a synchronous object in an App Router page.",
      "Do not merely mark the component async while retaining the old params type.",
      "Do not cast params through unknown or any to suppress the generated PageProps contract.",
      "Do not downgrade Next.js to retain synchronous request APIs."
    ]
  },
  "verification": {
    "scriptLanguage": "javascript",
    "workspaceFiles": {
      "package.json": "{\n  \"name\": \"synapse-next15-async-params-fixture\",\n  \"version\": \"1.0.0\",\n  \"private\": true,\n  \"scripts\": {\n    \"build\": \"next build\"\n  },\n  \"dependencies\": {\n    \"next\": \"15.5.9\",\n    \"react\": \"19.1.1\",\n    \"react-dom\": \"19.1.1\"\n  },\n  \"devDependencies\": {\n    \"@types/node\": \"22.15.3\",\n    \"@types/react\": \"19.1.10\",\n    \"@types/react-dom\": \"19.1.7\",\n    \"typescript\": \"5.8.3\"\n  }\n}\n",
      "next.config.mjs": "/** @type {import('next').NextConfig} */\nconst nextConfig = {};\n\nexport default nextConfig;\n",
      "next-env.d.ts": "/// <reference types=\"next\" />\n/// <reference types=\"next/image-types/global\" />\n\n// This file is generated by Next.js and must not be edited.\n",
      "tsconfig.json": "{\n  \"compilerOptions\": {\n    \"target\": \"ES2017\",\n    \"lib\": [\"dom\", \"dom.iterable\", \"esnext\"],\n    \"allowJs\": false,\n    \"skipLibCheck\": true,\n    \"strict\": true,\n    \"noEmit\": true,\n    \"esModuleInterop\": true,\n    \"module\": \"esnext\",\n    \"moduleResolution\": \"bundler\",\n    \"resolveJsonModule\": true,\n    \"isolatedModules\": true,\n    \"jsx\": \"preserve\",\n    \"incremental\": false,\n    \"plugins\": [{ \"name\": \"next\" }]\n  },\n  \"include\": [\"next-env.d.ts\", \"**/*.ts\", \"**/*.tsx\", \".next/types/**/*.ts\"],\n  \"exclude\": [\"node_modules\"]\n}\n",
      "app/layout.tsx": "import type { ReactNode } from \"react\";\n\nexport default function RootLayout({ children }: Readonly<{ children: ReactNode }>) {\n  return (\n    <html lang=\"en\">\n      <body>{children}</body>\n    </html>\n  );\n}\n",
      "app/blog/[slug]/page.tsx": "export default function Page({\n  params,\n}: {\n  params: { slug: string };\n}) {\n  return <h1>{params.slug}</h1>;\n}\n"
    },
    "reproductionScript": "const { spawnSync } = require('node:child_process');\nconst fs = require('node:fs');\nconst path = require('node:path');\n\nconst root = process.cwd();\nconst dependencyRoot = process.env.SYNAPSE_DEPENDENCY_ROOT;\nif (!dependencyRoot) {\n  console.error('PREREQUISITE_MISSING: SYNAPSE_DEPENDENCY_ROOT is not set');\n  process.exit(127);\n}\nconst dependencyModules = path.join(dependencyRoot, 'node_modules');\nconst nextBin = path.join(dependencyModules, 'next', 'dist', 'bin', 'next');\nconst nextPackage = path.join(dependencyModules, 'next', 'package.json');\nif (!fs.existsSync(nextBin) || !fs.existsSync(nextPackage)) {\n  console.error('PREREQUISITE_MISSING: install the exact package.json dependencies before verification; no network is used by this driver');\n  process.exit(127);\n}\nconst installed = JSON.parse(fs.readFileSync(nextPackage, 'utf8')).version;\nif (installed !== '15.5.9') {\n  console.error(`PREREQUISITE_VERSION_MISMATCH: expected next 15.5.9, got ${installed}`);\n  process.exit(126);\n}\nconst workspaceModules = path.join(root, 'node_modules');\ntry {\n  fs.symlinkSync(dependencyModules, workspaceModules, process.platform === 'win32' ? 'junction' : 'dir');\n} catch (error) {\n  console.error(`PREREQUISITE_LINK_ERROR: ${error.message}`);\n  process.exit(124);\n}\nconst result = spawnSync(process.execPath, [nextBin, 'build'], {\n  cwd: root,\n  encoding: 'utf8',\n  env: { ...process.env, CI: '1', FORCE_COLOR: '0', NEXT_TELEMETRY_DISABLED: '1', NO_COLOR: '1' }\n});\nif (result.error) {\n  console.error(`DRIVER_EXEC_ERROR: ${result.error.message}`);\n  process.exit(125);\n}\nprocess.stderr.write(`${result.stdout || ''}${result.stderr || ''}`);\nprocess.exit(result.status === null ? 125 : result.status);\n",
    "testSuite": "const { spawnSync } = require('node:child_process');\nconst fs = require('node:fs');\nconst path = require('node:path');\n\nconst root = process.cwd();\nconst dependencyRoot = process.env.SYNAPSE_DEPENDENCY_ROOT;\nif (!dependencyRoot) {\n  console.error('PREREQUISITE_MISSING: SYNAPSE_DEPENDENCY_ROOT is not set');\n  process.exit(127);\n}\nconst dependencyModules = path.join(dependencyRoot, 'node_modules');\nconst nextBin = path.join(dependencyModules, 'next', 'dist', 'bin', 'next');\nconst nextPackage = path.join(dependencyModules, 'next', 'package.json');\nif (!fs.existsSync(nextBin) || !fs.existsSync(nextPackage)) {\n  console.error('PREREQUISITE_MISSING: install the exact package.json dependencies before verification; no network is used by this driver');\n  process.exit(127);\n}\nconst installed = JSON.parse(fs.readFileSync(nextPackage, 'utf8')).version;\nif (installed !== '15.5.9') {\n  console.error(`PREREQUISITE_VERSION_MISMATCH: expected next 15.5.9, got ${installed}`);\n  process.exit(126);\n}\nconst workspaceModules = path.join(root, 'node_modules');\ntry {\n  fs.symlinkSync(dependencyModules, workspaceModules, process.platform === 'win32' ? 'junction' : 'dir');\n} catch (error) {\n  console.error(`PREREQUISITE_LINK_ERROR: ${error.message}`);\n  process.exit(124);\n}\nconst result = spawnSync(process.execPath, [nextBin, 'build'], {\n  cwd: root,\n  encoding: 'utf8',\n  env: { ...process.env, CI: '1', FORCE_COLOR: '0', NEXT_TELEMETRY_DISABLED: '1', NO_COLOR: '1' }\n});\nprocess.stdout.write(result.stdout || '');\nprocess.stderr.write(result.stderr || '');\nif (result.error) {\n  console.error(`DRIVER_EXEC_ERROR: ${result.error.message}`);\n  process.exit(125);\n}\nprocess.exit(result.status === null ? 125 : result.status);\n",
    "mutations": [
      {
        "id": "next15_async_only_old_params_type",
        "description": "Marks the page async but leaves params as the pre-v15 synchronous object type.",
        "unifiedDiff": "--- a/app/blog/[slug]/page.tsx\n+++ b/app/blog/[slug]/page.tsx\n@@ -1,4 +1,4 @@\n-export default function Page({\n+export default async function Page({\n   params,\n }: {\n   params: { slug: string };\n"
      },
      {
        "id": "next15_promise_type_without_unwrap",
        "description": "Changes the type to Promise but still reads slug synchronously instead of awaiting params.",
        "unifiedDiff": "--- a/app/blog/[slug]/page.tsx\n+++ b/app/blog/[slug]/page.tsx\n@@ -1,7 +1,7 @@\n export default function Page({\n   params,\n }: {\n-  params: { slug: string };\n+  params: Promise<{ slug: string }>;\n }) {\n   return <h1>{params.slug}</h1>;\n }\n"
      }
    ],
    "expectedPreExit": 1,
    "expectedPostExit": 0,
    "timeoutMs": 120000
  },
  "provenance": {
    "spdxLicense": "MIT",
    "primarySources": [
      "https://nextjs.org/docs/15/app/guides/upgrading/version-15",
      "https://nextjs.org/docs/15/app/api-reference/file-conventions/dynamic-routes",
      "https://nextjs.org/blog/next-15"
    ],
    "verifiedAt": "2026-08-25T05:37:11Z"
  }
}
